{
  "$schema": "https://json-schema.org/draft/2020-12/schema",
  "$id": "https://ai-business.example/schemas/evidence/m0-summary.v1.schema.json",
  "title": "M0 Evidence Summary",
  "description": "Machine-readable record of one quality-gate execution: which checks ran, what they exited with, which artifacts they produced, and which acceptance criteria that mechanically supports. This schema deliberately lives under evidence/ rather than contracts/: it governs an internal evidence document, not an inter-repository interface, so it is not a published contract and is not catalogued. Its $id is a URL rather than a contracts URN for the same reason - a URN in the contracts namespace would assert membership in a namespace this document does not belong to.",
  "type": "object",
  "properties": {
    "repository": { "type": "string", "const": "ai-business-contracts" },
    "milestone": { "type": "string", "const": "M0" },
    "commit_sha": {
      "type": "string",
      "pattern": "^[0-9a-f]{40}$",
      "description": "The commit the gate observed."
    },
    "generated_at_utc": {
      "type": "string",
      "pattern": "^\\d{4}-\\d{2}-\\d{2}T\\d{2}:\\d{2}:\\d{2}Z$"
    },
    "working_tree_clean": {
      "type": "boolean",
      "description": "Whether every tracked build input matched the commit when the gate ran. evidence/ is excluded because it is an output of the gate rather than an input to a build. A false value means the recorded commit_sha does not describe what was actually built, so no result in this document is release-valid."
    },
    "quality_gate": {
      "type": "object",
      "properties": {
        "result": { "type": "string", "enum": ["pass", "fail"] },
        "checks": {
          "type": "array",
          "minItems": 1,
          "items": {
            "type": "object",
            "properties": {
              "name": { "type": "string", "minLength": 1 },
              "command": { "type": "string", "minLength": 1 },
              "exit_code": { "type": "integer" },
              "status": { "type": "string", "enum": ["pass", "fail"] }
            },
            "required": ["name", "command", "exit_code", "status"],
            "additionalProperties": false
          }
        },
        "skipped": {
          "type": "array",
          "items": { "type": "string" },
          "description": "Checks not executed in this run. A non-empty list is a reduced run, and every criterion depending on a skipped check is reported not_run rather than assumed."
        }
      },
      "required": ["result", "checks", "skipped"],
      "additionalProperties": false
    },
    "artifacts": {
      "type": "array",
      "description": "Release artifacts present when the summary was written, with their real digests.",
      "items": {
        "type": "object",
        "properties": {
          "path": { "type": "string" },
          "sha256": { "type": "string", "pattern": "^[0-9a-f]{64}$" }
        },
        "required": ["path", "sha256"],
        "additionalProperties": false
      }
    },
    "criteria": {
      "type": "array",
      "minItems": 1,
      "items": {
        "type": "object",
        "properties": {
          "id": { "type": "string", "pattern": "^M0-CON-[0-9]{3}$" },
          "status": {
            "type": "string",
            "enum": ["pass", "fail", "not_run"],
            "description": "pass means every check in derived_from executed and exited 0 - nothing more. It is not a judgement that the criterion is satisfied in spirit; it is the mechanical consequence of the checks named here."
          },
          "derived_from": {
            "type": "array",
            "items": { "type": "string" },
            "description": "Gate checks whose exit codes determine this status. Empty means no executed check evidences this criterion, which forces not_run."
          },
          "note": { "type": "string" }
        },
        "required": ["id", "status", "derived_from"],
        "additionalProperties": false
      }
    },
    "criteria_summary": {
      "type": "object",
      "properties": {
        "pass": { "type": "integer", "minimum": 0 },
        "fail": { "type": "integer", "minimum": 0 },
        "not_run": { "type": "integer", "minimum": 0 },
        "total": { "type": "integer", "minimum": 1 }
      },
      "required": ["pass", "fail", "not_run", "total"],
      "additionalProperties": false
    },
    "milestone_verdict": {
      "type": "string",
      "enum": ["pass", "not_complete"],
      "description": "pass only when every criterion is pass. ACCEPTANCE_CRITERIA.md treats not_run as fail for milestone completion, so any not_run yields not_complete."
    }
  },
  "required": [
    "repository",
    "milestone",
    "commit_sha",
    "generated_at_utc",
    "working_tree_clean",
    "quality_gate",
    "artifacts",
    "criteria",
    "criteria_summary",
    "milestone_verdict"
  ],
  "additionalProperties": false
}
