{
  "artifacts": [
    {
      "path": "dist/ai-business-contracts-0.1.0.tar.gz",
      "sha256": "bf3b3d943d700d42021ebd28f92ced87e314a31380c6d3ddb8466a2e3cfbfc61"
    },
    {
      "path": "dist/contract-manifest.json",
      "sha256": "9086d84d8f9bc71cfa1bcfaa7f27afafe0e629771612bd6afd91f52591db621f"
    },
    {
      "path": "dist/SHA256SUMS",
      "sha256": "a433e47a01fac444a08d00401e6ad49f6249268409170746df7867f31892c08f"
    },
    {
      "path": "dist/compatibility-summary.json",
      "sha256": "ee436f80158419c03b4a7b2cd8b4a054c8cf7a0702c6ed24ea3d9f3c8ef0c50c"
    },
    {
      "path": "dist/example-consumer-lock.yaml",
      "sha256": "c5a445fa2cf1d9da2a1e83fa40b2b5bd4bb91062a2032a968fed771baeda85ad"
    }
  ],
  "commit_sha": "e5482e01147156459c59a70e071086583b70e22e",
  "criteria": [
    {
      "derived_from": [
        "check_no_implementation_code",
        "pytest"
      ],
      "id": "M0-CON-001",
      "status": "pass"
    },
    {
      "derived_from": [
        "validate_matrix",
        "pytest"
      ],
      "id": "M0-CON-002",
      "status": "pass"
    },
    {
      "derived_from": [
        "check_no_multitenancy",
        "pytest"
      ],
      "id": "M0-CON-003",
      "status": "pass"
    },
    {
      "derived_from": [
        "check_no_implementation_code",
        "pytest"
      ],
      "id": "M0-CON-004",
      "status": "pass"
    },
    {
      "derived_from": [
        "check_no_implementation_code",
        "pytest"
      ],
      "id": "M0-CON-005",
      "status": "pass"
    },
    {
      "derived_from": [
        "pytest"
      ],
      "id": "M0-CON-010",
      "status": "pass"
    },
    {
      "derived_from": [
        "validate_contracts",
        "validate_examples",
        "pytest"
      ],
      "id": "M0-CON-011",
      "status": "pass"
    },
    {
      "derived_from": [
        "validate_contracts",
        "validate_examples",
        "pytest"
      ],
      "id": "M0-CON-012",
      "status": "pass"
    },
    {
      "derived_from": [
        "validate_contracts",
        "validate_examples",
        "pytest"
      ],
      "id": "M0-CON-013",
      "status": "pass"
    },
    {
      "derived_from": [
        "validate_contracts",
        "validate_catalog",
        "pytest"
      ],
      "id": "M0-CON-014",
      "status": "pass"
    },
    {
      "derived_from": [
        "validate_catalog",
        "pytest"
      ],
      "id": "M0-CON-015",
      "status": "pass"
    },
    {
      "derived_from": [
        "check_references",
        "pytest"
      ],
      "id": "M0-CON-016",
      "status": "pass"
    },
    {
      "derived_from": [
        "validate_examples",
        "pytest"
      ],
      "id": "M0-CON-017",
      "status": "pass"
    },
    {
      "derived_from": [
        "pytest"
      ],
      "id": "M0-CON-020",
      "status": "pass"
    },
    {
      "derived_from": [
        "pytest"
      ],
      "id": "M0-CON-021",
      "status": "pass"
    },
    {
      "derived_from": [
        "pytest"
      ],
      "id": "M0-CON-022",
      "status": "pass"
    },
    {
      "derived_from": [
        "validate_contracts",
        "pytest"
      ],
      "id": "M0-CON-023",
      "status": "pass"
    },
    {
      "derived_from": [
        "check_compatibility",
        "pytest"
      ],
      "id": "M0-CON-024",
      "status": "pass"
    },
    {
      "derived_from": [
        "check_compatibility",
        "pytest"
      ],
      "id": "M0-CON-025",
      "status": "pass"
    },
    {
      "derived_from": [
        "check_compatibility",
        "pytest"
      ],
      "id": "M0-CON-026",
      "status": "pass"
    },
    {
      "derived_from": [
        "check_compatibility",
        "pytest"
      ],
      "id": "M0-CON-027",
      "status": "pass"
    },
    {
      "derived_from": [
        "check_compatibility",
        "pytest"
      ],
      "id": "M0-CON-028",
      "status": "pass"
    },
    {
      "derived_from": [
        "check_compatibility",
        "pytest"
      ],
      "id": "M0-CON-029",
      "status": "pass"
    },
    {
      "derived_from": [
        "quality_gate"
      ],
      "id": "M0-CON-030",
      "status": "pass"
    },
    {
      "derived_from": [
        "pytest"
      ],
      "id": "M0-CON-031",
      "status": "pass"
    },
    {
      "derived_from": [
        "ruff_format",
        "ruff_lint",
        "mypy"
      ],
      "id": "M0-CON-032",
      "status": "pass"
    },
    {
      "derived_from": [
        "pytest"
      ],
      "id": "M0-CON-033",
      "status": "pass"
    },
    {
      "derived_from": [
        "secret_scan"
      ],
      "id": "M0-CON-034",
      "status": "pass"
    },
    {
      "derived_from": [
        "dependency_audit",
        "pytest"
      ],
      "id": "M0-CON-035",
      "status": "pass"
    },
    {
      "derived_from": [
        "build_bundle",
        "verify_bundle",
        "pytest"
      ],
      "id": "M0-CON-036",
      "status": "pass"
    },
    {
      "derived_from": [
        "verify_bundle",
        "pytest"
      ],
      "id": "M0-CON-037",
      "status": "pass"
    },
    {
      "derived_from": [
        "verify_bundle"
      ],
      "id": "M0-CON-038",
      "status": "pass"
    },
    {
      "derived_from": [
        "validate_matrix",
        "pytest"
      ],
      "id": "M0-CON-040",
      "status": "pass"
    },
    {
      "derived_from": [
        "build_bundle",
        "verify_consumer_lock"
      ],
      "id": "M0-CON-041",
      "status": "pass"
    },
    {
      "derived_from": [
        "verify_consumer_lock",
        "pytest"
      ],
      "id": "M0-CON-042",
      "status": "pass"
    },
    {
      "derived_from": [
        "check_evidence",
        "pytest"
      ],
      "id": "M0-CON-043",
      "status": "pass"
    },
    {
      "derived_from": [
        "check_evidence"
      ],
      "id": "M0-CON-044",
      "note": "check_evidence verifies the recorded verdict structurally -- that a completed audit for a reachable commit exists, returns PASS, and covers every criterion. It does not decide that the audit passed; that is the auditor's judgement, and a gate asserting it would be the circular evidence AUDITOR.md section 7 rejects.",
      "status": "pass"
    },
    {
      "derived_from": [
        "check_evidence"
      ],
      "id": "M0-CON-045",
      "note": "check_evidence verifies the delivery verdict is derivable: the report may not claim PASS while any criterion it reports reads FAIL or NOT RUN.",
      "status": "pass"
    }
  ],
  "criteria_summary": {
    "fail": 0,
    "not_run": 0,
    "pass": 38,
    "total": 38
  },
  "generated_at_utc": "2026-08-08T16:42:28Z",
  "milestone": "M0",
  "milestone_verdict": "pass",
  "quality_gate": {
    "checks": [
      {
        "command": "uv run ruff format --check .",
        "exit_code": 0,
        "name": "ruff_format",
        "status": "pass"
      },
      {
        "command": "uv run ruff check .",
        "exit_code": 0,
        "name": "ruff_lint",
        "status": "pass"
      },
      {
        "command": "uv run mypy",
        "exit_code": 0,
        "name": "mypy",
        "status": "pass"
      },
      {
        "command": "uv run pytest -q",
        "exit_code": 0,
        "name": "pytest",
        "status": "pass"
      },
      {
        "command": "uv run python scripts/validate_contracts.py",
        "exit_code": 0,
        "name": "validate_contracts",
        "status": "pass"
      },
      {
        "command": "uv run python scripts/check_references.py",
        "exit_code": 0,
        "name": "check_references",
        "status": "pass"
      },
      {
        "command": "uv run python scripts/validate_examples.py",
        "exit_code": 0,
        "name": "validate_examples",
        "status": "pass"
      },
      {
        "command": "uv run python scripts/validate_catalog.py",
        "exit_code": 0,
        "name": "validate_catalog",
        "status": "pass"
      },
      {
        "command": "uv run python scripts/validate_matrix.py",
        "exit_code": 0,
        "name": "validate_matrix",
        "status": "pass"
      },
      {
        "command": "uv run python scripts/check_compatibility.py --output dist/compatibility-summary.json --checked-at 2026-08-08T16:38:19Z",
        "exit_code": 0,
        "name": "check_compatibility",
        "status": "pass"
      },
      {
        "command": "uv run python scripts/check_no_multitenancy.py",
        "exit_code": 0,
        "name": "check_no_multitenancy",
        "status": "pass"
      },
      {
        "command": "uv run python scripts/check_no_implementation_code.py",
        "exit_code": 0,
        "name": "check_no_implementation_code",
        "status": "pass"
      },
      {
        "command": "uv run python scripts/check_secrets.py",
        "exit_code": 0,
        "name": "secret_scan",
        "status": "pass"
      },
      {
        "command": "uv run pip-audit --progress-spinner=off --strict",
        "exit_code": 0,
        "name": "dependency_audit",
        "status": "pass"
      },
      {
        "command": "uv run python scripts/build_bundle.py",
        "exit_code": 0,
        "name": "build_bundle",
        "status": "pass"
      },
      {
        "command": "uv run python scripts/verify_bundle.py",
        "exit_code": 0,
        "name": "verify_bundle",
        "status": "pass"
      },
      {
        "command": "uv run python scripts/verify_consumer_lock.py --lock dist/example-consumer-lock.yaml --manifest dist/contract-manifest.json --verify-manifest-digest",
        "exit_code": 0,
        "name": "verify_consumer_lock",
        "status": "pass"
      },
      {
        "command": "uv run python scripts/check_evidence.py",
        "exit_code": 0,
        "name": "check_evidence",
        "status": "pass"
      },
      {
        "command": "scripts/quality_gate.sh",
        "exit_code": 0,
        "name": "quality_gate",